day,breakfast,lunch,dinner
Monday,"Poha, Tea","Dal, Rice, Roti, Sabzi","Paneer, Rice, Roti, Salad"
Tuesday,"Idli, Sambar","Rajma, Rice, Roti","Chole, Roti, Rice"
Wednesday,"Bread, Butter, Omelette","Dal Fry, Rice, Roti","Mixed Veg, Roti, Rice"
Thursday,"Upma, Tea","Kadhi, Rice, Roti","Egg Curry, Roti, Rice"
Friday,"Puri, Sabzi","Dal Makhani, Rice, Roti","Paneer Butter Masala, Naan"
Saturday,"Dosa, Chutney","Biryani, Raita","Dal, Rice, Roti, Kheer"
Sunday,Chole Bhature,Special Thali,"Fried Rice, Manchurian"
